,pubMed,clinicTrial,pubMed_Title,pubMed_keywords,clinicTrial_Title,clinicTrial_keywords,keywords_common
0,816,964,prior pacemaker implantation and clinical outcomes in patients with heart failure and preserved ejection fraction,estimated may filtration cardiac dysfunction . glomerular datum driven implantation left sudden electrical pacing right causes method pacemaker therapy 026 mechanical mainly ) risk function rates may patientscardiac systolic lower conventional ventricular ejection dyssynchrony high conclusion preserved 6 patientprior crt indexes failure device mass body year induced dyssynchrony heart e clinical outcomes per fraction 100 worsen death,quantitative mri for characterizing heart failure with preserved ejection fraction,psychology ) coronary fibrosis magnetic resonance imaging research clinical testing serial imaging imaging approach treatment response public health prognostic marker physiologic pulse myocardial tissuepreserved ejection fraction characterizing heart failure quantitative mri,ejection failure heart fraction clinical )
1,706,319,sex differences and long-term outcome in patients with pacemakers,valvular underwent pacemaker cardiac ablation patients block kidney consisted increased pacing men coronary replacement ventricular artery pacemaker 19 chronic 64 without ) lead cardiovascular fibrillation influenced ventricular comorbidities longatrial implantations significantly disease regurgitation year sex cohort study diseaseterm heart heart outcome tricuspid differences center pacemakers threshold case,androgen receptors and sex differences in the biological clock,enterobacteria phage p1 cre recombinase designer receptors exclusively activated science ) endocrine retinal ganglion cells biological neural networks gonadal steroid hormones nervous system disorder designer drugs steroid hormone nervous systemsex differences biological clock androgen receptors,) differences
2,493,426,predictors of death in chronic chagas cardiomyopathy patients with pacemaker,study independent 150ms pacemaker fraction class annual mortality 32chronic patients datum left atrial final qrs enlargement method therapy variables deathcardiac ) 43 003 risk multivariate logistic included advanced model ejection high conclusion ventricular prospective chagas ≥ rate crt 034 disease five renal device cohort high year ≤ despite cardiomyopathy hf center rate predictors functional regression,predictors of cardiomyopathy progression in a chagas disease cohort in bolivia,connective tissue growth factor transforming growth factors science ) epidemiology brain natriuretic peptide congestive heart failure matrix metalloproteinase inhibitor public health relevance heart disease risk heart diseases matrix metalloproteinaseschagas disease cohort cardiomyopathy progression predictors bolivia,disease cohort risk ) predictors cardiomyopathy
3,18,326,risk factor for cardiac permanent pacemaker infection,study square pacemaker regression cardiac pulmonary ablation dual block obstructive factorscardiac aureus variable ventricular test pacemaker retrospective chronic causing microorganism control fibrillation multivariate infections resistant analysis methicillin contributing model case staph infection chi significantly disease year risk factoratrial permanent infection prevalent staphylococcus using methicilin heart susceptible case chamber,regulation and function of the circadian factor period2,simian virus 40 public health relevance high fat diet embryonic stem cell chromosome conformation capture cell differentiation process energy metabolism pathway regulatory pathway energy metabolism upstream kinasecircadian factor period2 regulation function,
4,334,519,lead-sparing tricuspid valve repair damaged by pacemaker lead,may muscle pacemaker cardiac ablation block insidesparing annuloplasty valve ventricular pacemaker leadatrial lead causing containing fibrillation lead ring uncommon ways damaged sparing regurgitation various year repair complication muscle permanent posterior severe damage heart caused tricuspid papillary repair valve case,removal of damaged mitochondria by alternative autophagy,reactive oxygen species ripk1 gene release factor quality control parkin gene myocardial dysfunction mitochondrial dysfunction mitochondrial autophagy knockout mice golgi apparatusdamaged mitochondria alternative autophagy removal,
5,680,128,an application of pacemaker respiratory monitoring system for the prediction of heart failure,positive pacemaker system cardiac prediction ablation report block index imply disturbance impedance complications applicationatrial 200 facilitate ventricular using respiratory monitoringpacemaker sorin sr fibrillation could sas monitoring case among airway sleep device sensor algorism year thoracic failure pressure common heart crm using sensor heart reply apnea case,a device for monitoring heart failure patients,current procedural terminology codes digital signal processing chest wall structure signal transduction therapeutic intervention smartphone application readmission rates public health positioning attribute myocardial contractionmonitoring heart failure patients device,failure device heart
6,634,173,a rare indication of permanent pacemaker implantation in children: congenital long qt syndrome,may torsades prolonged pacemaker cardiac dangerous ablation implantation block sudden childrenatrial congenital long bradycardia ventricular pacemaker deathcongenital fibrillation cause resistant qt even rare disorder de year pointes permanent avoid heart syndrome arrhythmic interval case death indication,mechanisms of long qt syndrome 1 in heart,fluorescence resonance energy transfer public health relevance long qt syndrome genetic regulatory protein sudden cardiac death kinase anchoring protein protein kinase ward syndrome protein expression adenylate kinaselong qt syndrome 1 mechanisms heart,cardiac sudden heart qt death syndrome long
7,449,787,pacemaker implantation after catheter ablation for atrial fibrillation,index pacemaker cardioversion congestive cardiac ablation hazards cox charlson groups implantation block us atrial female commercial ventricular dysfunction pacemaker certain ) modelspacemaker insurance years fibrillation 2 1 ) gender fibrillationatrial node chads2 higher ps matched baseline within large )- 0 sinus year score requiring database year 2 catheter heart heart (≥ 0 comorbidities 50 patients proportional 28 failure versus case,molecular mechanisms for atrial fibrillation in aging,science ) genetically engineered mouse protein kinase c epsilon public health relevance protein structure targeted agent signal pathway roentgen rays ray crystallography phosphatidylinositol 4 pathway interactionsmolecular mechanisms atrial fibrillation aging,) fibrillation atrial
8,465,75,device complications in adult congenital heart disease,948 pacemaker cardiac ablation devices regression implantation block robust congenital ventricular toward pacemaker using identify without errorsadult fibrillation chd rates undergoing lower complicationsatrial 852 among trend transvenous 30 receiving disease year adult complication standard implantation heart using icd heart patients poisson initial case device,genetic mechanisms of congenital heart disease,united states national institutes computed tomography screening atrioventricular septal defect next generation sequencing genetic screening method congenital heart disorder national institute national heart gene defect congenital abnormalitycongenital heart disease genetic mechanisms,disease congenital heart
9,184,539,troubleshooting a pacemaker output failure: a case report,expanding advised even oversensing offer intrinsic quality automatic datum modern replacement method therapy though output rapidly lead risk need pm report stretched high r ventricular case conclusion resulting pms wave crt functionpacemaker receiving resources failure device troubleshootingcardiac year good hospital care pms patients already occurred medical sensitivity,regulation of cardiac power output in health and disease,induced pluripotent stem cell stem cells cell type cell motility heart cell tissue engineering sudden death single molecule positioning attribute pharmaceutical preparationscardiac power output regulation health disease,output
10,27,615,pacemaker use following heart transplantation,%- hearts usually pacemaker 24 cardiac dysfunction presents ablation 30 room operating transplant implantation block transplanted bradycardia arrhythmiaspacemaker ventricular pacemaker pacemakers fibrillation transplantationatrial %. node anastomosis significant within days reperfusion sinus use year implanted bicaval requiring exhibit 2 vs heart heart later rhythm biatrial following patients early case device,innate immune mechanisms of ischemia reperfusion injury following cardiac transplantation,intercellular adhesion molecule 1 cell adhesion molecules linked immunosorbent assay adaptor signaling protein novel imaging technology innate immune system imaging approach tlr3 gene targeted treatment ripk3 geneischemia reperfusion injury following cardiac transplantation innate immune mechanisms,following cardiac reperfusion
11,153,211,placement of cardiac pacemaker trial (pocket) - rationale and design: a randomized controlled trial,system pacemaker cardiac consecutive enroll sizes cardiac patients leads case ablation block technique trial 200 two consists concealed pacemaker connectedrandomized rationale ventricular procedure pocket visual fibrillation sequentially block controlled alternative allocation prospective interventional rct placement year scale would analog using heart designatrial designed random numbered,randomized controlled trial of group prevention coaching,health care facility randomized controlled trials cardiovascular risk factor cardiovascular disorder risk cardiovascular disorder prevention primary health care heart disease risk cardiovascular system cardiovascular diseases risk reductionrandomized controlled trial group prevention coaching,trial system controlled heart
12,221,251,phrenic nerve stimulation a rare complication of pacemaker: a case report,aortic cardiac presented old implantation left block bundle pacemakervalve outcome spasmsphrenic ventricular pacemaker aortic group contraction risk involuntary man technology transcatheter report branch rare high case emergency distal due nerve therapy unit persistent intermittent stimulation geriatric year tavr painless mortality resynchronization valve complication abdominal devices,automatic phrenic nerve stimulation to rescue opioid induced respiratory depression,small business innovation research grant .) central sleep apnea sleep apnea syndromes health care costs operative surgical procedures hypercapnic respiratory failure heart failure ventilatory depression united states target populationsrescue opioid induced respiratory depression automatic phrenic nerve stimulation,nerve stimulation
13,712,174,real world mri experience with nonconditional and conditional cardiac rhythm devices after magnasafe,178 underwent pacemaker cardiac cardiac consecutive ablation intrinsic demonstrated devices patients nonconditional block examined rhythm ventricular safety rates 212 nonconditional magnasafe fibrillation resonance rates recent experience mris magnetic implantable magnasafeatrial registry year thoracic modesreal conditional mri cardioverter electronic standard ≤ 40 world heart nonthoracic imaging scans prospectively case,affective science and smoking cessation: real time real world assessment,longitudinal cohort study informal social control heart rate variability ecological momentary assessment geographic information systems smoking cessation intervention smoking cessation wireless technology time systems public healthreal time real world assessment smoking cessation affective science,world heart
14,165,512,development of pacemaker lead thrombosis in a patient with atrial fibrillation during apixaban treatment,bodies datum old developmentcardiac left atrial apixaban thrombosis female method pacemaker therapy nonvalvular lead risk fibrillation lead intracardiac high conclusion patient treatment crt use foreign year appendage clinical fibrillationpacemaker regarding device information,atrial fibrillation treatment in older adults,multiple chronic conditions risk benefit ratio chronic kidney failure coronary heart disease heart failure heart rhythm heart rate heart arrest uncertain risk treatment efficacyatrial fibrillation treatment older adults,fibrillation treatment risk
15,928,869,progression of device-detected subclinical atrial fibrillation and the risk of heart failure,old asymptomatic progression pacemaker cardiac modelsdetected ablation patients cox case longest index 65 block atrial examined pacing trial ventricular reduction risk years fibrillation longer within monitoring subclinical among short term ≥ episode continuous dependent year failure greater duration mass body fibrillation whose heart scaf deviceatrial heart patients hf hospitalization detects,optimizing outcomes for patients with heart failure and atrial fibrillation,series research career programs public health relevance health services research health related quality patient outcomes assessments outcomes research research methodology health system focused outcomes career developmentoptimizing outcomes heart failure atrial fibrillation patients,atrial failure fibrillation heart patients
16,293,492,pacemaker lead endocarditis due to trichosporon species,aortic mortality nonspecific blood implantation endocarditis obtaining outcome negative pacemaker group endocarditis lead symptoms risk rates studies high fungal due related high year tavr appropriate unexpected clinical speciesvalve imaging culture speciespacemaker mortality complication trichosporon,multiscale modeling to map cardiac electrophysiology between species,induced pluripotent stem cell sudden cardiac death drug response prediction cardiac electrophysiologic techniques cell type cell model cardiac myocytes united states tissue model protocols documentationmap cardiac electrophysiology multiscale modeling species,
17,169,292,safety evaluation of a leadless transcatheter pacemaker for magnetic resonance imaging use,leadless pacemaker system indicated datum evaluationcardiac heating including traditional tests evaluate method revealed pacemaker assessment therapy gelled simulations risk resonance heatingmagnetic risks transcatheter incorporating high conclusion case safety saline phantom magnetic carlo crt conducted monte use conditional mri year study induced clinical imaging imaging clinically potential micra pacemakers scan increased device containing,coronary magnetic resonance angiography,coronary computed tomography angiography public health relevance magnetic resonance angiography computerized data processing coronary artery calcification magnetic resonance imaging magnetic resonance coronary artery coronary arteriosclerosis medical imagingcoronary magnetic resonance angiography,imaging resonance magnetic
18,467,875,rescue leadless pacemaker implantation in a pacemaker-dependent patient with congenital heart disease and no alternative routes for pacing,leadless pacemaker patients datum implantation congenital suitable method group pacemaker therapy experienced risk pacingcardiac regarding surgically alternative high conclusion candidaterescue transvenous patient crt induced de dependent disease related complications unique year heart whether novo disease routes patients pacing device,perinatal no signaling in congenital heart disease,shock proteins 90 operative surgical procedures congenital heart disorder congenital heart defects nitric oxide synthase nitric oxide vascular endothelium vascular diseases vascular abnormality treatment efficacycongenital heart disease signaling perinatal,disease congenital heart
19,650,674,safety of leadless pacemaker implantation in the very elderly,hematomas access hours shorter underwent pacemaker 24 effusion clock 5 pericardial implantation gene site chamber minutes traditional mouse 564 %) mlp pacemaker safety activity lead 8 time (< times cell expression acute tvp pacemakerleadless transvenous 6 across 0 significantly mean 7 procedure scn elderlycircadian vs 62 ± 23 rhythm patients dislodgments hospitals,nutritional therapy in elderly with heart failure,randomized clinical trials metabolic abnormality assessment phase 1 study health related quality weight gain stable isotope skeletal muscle sedentary lifestyle secondary endpoint protein biosynthesisnutritional therapy heart failure elderly,
20,406,589,cardiac memory following pacemaker implantation,pacemaker ecg cardiac outpatient ablation control implantation left block bundle inversions coronary ventricular pacemaker described implantationatrial lead years fibrillation ago duecardiac routine branch acute ventricular due year hypertrophy standard severe heart wave 238 50 patients already following syndrome memory case,memory cd4 helper t cells and antibody production following renal transplantation,mhc class ii genes collagen type iv cytokine network pathway autoreactive b cell mhc class pathway interactions transplant recipients tnfsf5 gene tnfrsf5 gene tissue graftsantibody production following renal transplantation memory cd4 helper cells,following memory
21,882,287,biology of the sinus node and its disease,genes usually pacemaker dysfunction normal datum function method pacemaker therapy node risk current sinoatrial high conclusion biologycardiac evidence review crt important summarises processsinus understood disease related incompletely key year attributed san regarding fibrosis device,cell biology pathology and imaging core,functional magnetic resonance imaging magnetic resonance imaging renal blood flow ray computed tomography chronic kidney failure whole animal imaging functional disorder whole organism animal model tissue imagingimaging core cell biology pathology,
22,547,751,physical activity and mortality in older patients with a pacemaker,appear pacemaker activity regression consecutive cardiac ablation cox patients operating low receiver block geriatr 21 int mortalityatrial ventricular activity rates daily ) characteristic years fibrillation multivariate time rates 107 cases investigated higher among ≥ rate years 0 significantly year gerontol 2020 75 whether 3physical heart older curve physical aged case analysis identified,testing adaptive interventions to improve physical activity for sedentary women,academic medical centers heart disease risk cardiovascular disorder risk public health relevance heart diseases cardiovascular health trial design treatment effect strenuous exercise social supporttesting adaptive interventions improve physical activity sedentary women,physical activity heart
23,949,463,the epigenetic pacemaker: modeling epigenetic states under an evolutionary framework,pacemaker aortic https maximization frameworkvalve implantation landscapes estimates outcome medicalmodeling expectation group states risk changes mutation rates high epigenetic rate python aging evolutionary conditional vast along year :   tavr 3 mortality version algorithm pypi linear,epigenetic reprogramming in atherosclerosis,fatty acid glycerol esters activating transcription factor 3 high density lipoprotein cholesterol systemic lupus erythematosus new therapeutic target high density lipoproteins coronary artery occlusion arterial fatty streak gene expression profiling enzyme inhibitor drugsepigenetic reprogramming atherosclerosis,high 3
24,760,665,attack graph modeling for implantable pacemaker,attack pacemaker system characterized graph automatic cardiac ablation devices formally systems block aadl remote measuresattack ventricular pacemaker jkind modeling ) checker tool security fibrillation audit analysis health graph model monitoring modeled pacemakeratrial implantable year architecture developed appropriate showed using heart breaches classifies generated case medical,the northern and central vietnam heart attack study,united states national institutes case fatality rates coronary heart disease acute myocardial infarction myocardial infarction readmission rates heart diseases myocardial reperfusion disease surveillance disease ratecentral vietnam heart attack study northern,attack heart case
25,46,453,generation of cardiac pacemaker cells by programming and differentiation,system program pacemaker activity cardiac cardiac practice ablation single block factors factor ventricular pacemaker channel differentiationatrial fibrillation gene function specific created risks generation tbx18 transcription .cardiac includes sensitive ion sinus like year programming key cell therapeutic diseased sick heart cells factor heart conduction another including one successful hcn1 syndrome starting case membrane,stemness and differentiation potential are defined by metabolism in cardiac progenitor cells,oncogene protein c environmental risk factor reactive oxygen species cellular metabolic process stem cell division cellular biology like cell cell proliferation cell physiology cell linecardiac progenitor cells differentiation potential stemness metabolism defined,factor cells like cell
26,82,596,modeling pacemaker deterioration with age,activity datum method pacemaker therapy risk changes heartsmodeling sinoatrial high conclusion jgp node deterioration crt year study new agecardiac aged device models,multiscale modeling of circadian rhythms,sleep wake cycle cellular metabolic process cell growth regulation metabolic diseases mammalian cell cell type cell model transcription factor new technology gene expressionmultiscale modeling circadian rhythms,new
27,350,195,leadless pacemaker implant after heart transplant,leadless pacemaker clock transplant longest gene us implant mouse relatedleadless activity pacemaker first transplantcircadian transplantation duration recipient cell technology expression conventional transvenous several mainly complications reported permanent scn heart rhythm pacemakers case,cell death pathways and heart transplant rejection,end stage renal failure innate immune response new therapeutic target delayed graft function pattern recognition receptor mannose binding lectin graft failure therapeutic intervention graft survival graft rejectionheart transplant rejection cell death pathways,cell transplant
28,323,855,the influence of cardiac pacemaker programming modes on exercise capacity,92 mode pacemaker programming cardiac influences capacity datum function pacing chamber two method test pacemaker group therapy responsive ratecardiac risk metabolic high conclusion rate crt equivalents compared year common heart influencecardiac stress modes device exercise group,influence of exercise weight loss and exercise plus weight loss on sleep apnea,operative surgical procedures magnetic resonance imaging randomized controlled trials public health relevance heart rate variability body weight decreased sleep apnea syndromes obstructive sleep apnea weight loss intervention heart imagingexercise plus weight loss weight loss sleep apnea exercise influence,exercise rate heart
29,170,504,a technique to prevent recurrence after the repair of pacemaker lead-induced tricuspid regurgitation,prevent pacemaker article cardiac ablation preventing block pacing regurgitation ventricular pacemaker without lead describes fibrillation recurrence apparatus lead eliminateinduced leads removing regurgitation year repair induced technique leaflets heart tricuspid repairatrial contact case,control of cardiac fibrosis to prevent cardiac function deterioration,transforming growth factor beta public health relevance drug delivery systems vitro model toxic effect signal pathway principal investigator pathway interactions myocardial rupture myocardial infarctionprevent cardiac function deterioration cardiac fibrosis control,cardiac
30,732,333,postcardiac injury syndrome and stroke following permanent pacemaker insertion,pacemaker woman patient became cardiac chest presented ablation pleuritic despite left dual old initially recovered pain atrial territory postcardiac insertion cerebellar ventricular artery gradually pacemaker antibiotics shortstroke block deteriorated fibrillation febrile episodes recurrent 10 days syndromeatrial progressively year anterior permanent injury new heart inferior well syndrome following case chamber associated,built environments on stroke risk and stroke disparities in a national sample,united states national institutes southeastern united states case fatality rates environmental risk factor public health relevance coronary heart disease american heart association cardiovascular risk factor united states cardiovascular diseasesstroke risk stroke disparities national sample built environments,heart case
31,388,236,leadless pacemaker implantation under direct visualization during valve surgery,leadless direct thresholds remainder underwent cardiac datum 5 cardiopulmonary implantation pacing replacement 151 method pacemaker therapy allowed surgery risk reliable surgeryleadless included concomitant performance undergone undergoing high conclusion 17 crt days years multivalve bypass year isolated ± tricuspid 119 patients already visualizationcardiac repair valve device,molecular mechanisms of direct cardiac reprogramming,nucleic acid regulatory sequences ring finger domain public health relevance acute myocardial infarction small hairpin rna rna polymerase ii chromatin remodeling factor rna splicing transcription factor tbx5 proteindirect cardiac reprogramming molecular mechanisms,cardiac
