,pubMed,clinicTrial,pubMed_Title,pubMed_keywords,clinicTrial_Title,clinicTrial_keywords,keywords_common
63,10,929,the impact of cardiac pacemaker implantation on male sexual function,6 pacemaker cardiac cardiac ablation affect satisfaction implantation block least function intercourse rhythm months ventricular dysfunction disorders pacemaker 87 fibrillation erectile 1 76 day 7 desire within 6 pmale sexual year occurred overall heart desire heart p ± impactatrial case,impact of disruptions in the serotonin system on cardiac development,selective serotonin reuptake inhibitor series research career programs serotonin receptor 5 congenital heart disorder congenital heart defects serotonin transporter research personnel clinical research career development heart visualizationserotonin system cardiac development impact disruptions,cardiac heart
64,611,600,patient exposure during fluoroscopy-guided pacemaker implantation procedures,radiological estimated software pacemaker excessive cardiac patient effective ablation based block ). doses ventricular national pacemaker protection procedure fibrillation current conditions radiation health exposure board fluoroscopyatrial agency doseguided sd year mean overall study evaluated implantation clinical using ± per heart procedures manage dose 1msv case many highest,appropriate use of cardiovascular procedures to optimize healthcare value,specific qualifier value percutaneous coronary intervention environmental risk factor coronary heart disease health care delivery health care costs care delivery care costs health expenditures coronary arteriosclerosisoptimize healthcare value cardiovascular procedures appropriate use,procedures health heart
65,631,662,arrhythmias in relation to mortality after transcatheter aortic valve replacement,001 pacemaker cardiac ablation 30 block bundle implant right replacement potentially related ventricular pacemaker aortic significant ) fibrillation factors leveltranscatheter block transcatheter branch complete remained within albumin implant days year 566 requiring heart implantation relation heart 25 ± mortality patients modifiable undergo arrhythmiasatrial valve case 496,maternal sleep and sleep disturbance in relation to the developing fetus,nervous system structure heart rate variability sleep apnea syndromes obstructive sleep apnea public health relevance fetal heart rate adverse pregnancy outcome pregnancy outcome sleep quality sleep disturbancessleep disturbance maternal sleep developing fetus relation,heart relation
66,66,296,a case of takotsubo cardiomyopathy developing ventricular fibrillation after a pacemaker implantation,caseatrial pacemaker cardiac cardiac ablation case hardly implantation left revealed block ventriculogram complications potentially ventricular pacemaker threatening ever occurs procedure arrest commonly fibrillation days even latertakotsubo invasive ventricular procedures takotsubo due caused minimally arrest year complications developed hospital used heart cardiomyopathy fatal stress ten developing hypercontraction leading,developing nicorandil and companion biomarkers for dmd cardiomyopathy therapy,mitochondrial permeability transition pore induced pluripotent stem cell muscular dystrophy mouse model reactive oxygen species nitric oxide donors duchenne muscular dystrophy muscular dystrophy cardiomyopathy muscular dystrophies mouse strains mitochondrial membranedmd cardiomyopathy therapy developing nicorandil companion biomarkers,developing cardiomyopathy
67,145,112,uncovering the roles of clocks and neural transmission in the resilience of drosophila circadian network,drosophila output circadian pacemaker preceding cardiac evidence ablation case surprisingly uncovering block sustain passively network functionally ventricular translational pacemaker melanogaster predictions fibrillation rhythmic clocksatrial running theoretical together phenomenon receives subclassesdrosophila transmission gave year loops behavior neural inputs circuit locomotor rhythms heart roles also slowly feedback resilience diverse suggests,the role of circadian clocks in photoreceptor cell development maintenance and function,age related macular degeneration science ) event gene expression regulation candidate disease gene retinal ganglion cells retinal degeneration differential expression arntl gene gene proteins visual processingphotoreceptor cell development circadian clocks role maintenance function,circadian
68,761,462,transcription factor tbx18 reprograms vascular smooth muscle cells of ascending aorta to pacemaker-like cells,action muscle showed transfected pacemaker cardiac explored vascular dwarf ablation block potential factor cardiomyocytes shox2 human ventricular aortic ) node fibrillation could gene protein typical levels reprogram insulin hcn4 pacemakeratrial tbx18 transcription ventricular reprograms vsmcs rat homeobox vsmcs ascending (+) enhancer sinus 1 like year expressed high nrvms study neonatal smooth aorta binding whether cells heart coupledtranscription case,regulation of vascular smooth muscle cell function in atherosclerosis,smooth muscle myocytes phospholipase c gamma arterial fatty streak vascular smooth muscle immune system diseases vascular system cardiovascular system united states tyrosine kinases synaptic vesiclesvascular smooth muscle cell function regulation atherosclerosis,muscle vascular smooth
69,320,115,first clinical experience with the kora pacemaker system in congenital complete heart block in newborn infants,95 limited treated minute showed kora system infantsvalve patient aortic implantation block traction three suffering outcome including ventilation skin aortic pacemaker first group analyzed experienced risk velocity integral retrospectively time values showing complete high circadiane experience seems adaption beats rate vti values newborn high year tavr heart clinical sensor per mortality one growthscongenital patients minute,behavioral and physiological responses to oral feeding in infants with complex congenital heart disease,operative surgical procedures cardiac surgery procedures 2 year old congenital heart disorder heart rate variability high risk population high risk infant high risk heart rate risk factorscomplex congenital heart disease physiological responses oral feeding infants behavioral,high rate heart risk year
70,642,487,tbx18-dependent differentiation of brown adipose tissue-derived stem cells toward cardiac pacemaker cells,downstream provide cardiac cells tissue data datum block atrial factors cardiomyocytes including tbx18cardiac two method toward pacemaker additional therapy without risk mechanism high conclusion ventricular transcription spontaneous treatment beating crt important dependent differentiation evidencederived underlying sinus key brown year differential sick severe factor cells ultrastructure syndrome stem regarding device adipose,a novel role for brown adipose tissue enhance heart function and metabolism,wild type mouse physiologic intraventricular pressure novel therapeutic intervention united states signal transduction research proposals protective effect oxygen consumption novel therapeutics molecular profilingbrown adipose tissue enhance heart function novel role metabolism,adipose tissue
71,918,786,german roentgen society statement on mr imaging of patients with cardiac pacemakers,whole pacemaker sar provide pulsoximetry patient cardiac cardiac ablation devices case block guidelines close society dedicated obtain ventricular exclusion fibrillation sargerman patientsatrial pm value maximum zones consent statement continuous requires year conditional mr body requires full clinical using comprehensive heart imaging practice imaging patients pacemakers informed roentgen cooperation,mr pet imaging of coronary atherosclerosis,public health relevance arterial fatty streak magnetic resonance imaging ray computed tomography acute myocardial infarction myocardial infarction computed tomography vascular bed soft tissue sodium fluoridepet imaging coronary atherosclerosis mr,imaging mr
72,87,402,syncope in patients with pacemakers,positive system aortic vasovagal results patients implantation outcome tests negative pacemaker group carotid risk test paced syncope pointing high depend node pacemakersvalve malfunction vastly disease sinus approach positivity different year tavr show mortality older syndrome patients tilt resultssyncope,syndicare: syncope decision aid for emergency care,public health relevance shared decision making emergency department physician emergency department evaluation structural heart disease acute coronary syndrome research project grants randomized controlled trials emergency department visit emergency department patientsyncope decision aid emergency care syndicare,disease syndrome
73,805,952,the risk factors of new-onset atrial fibrillation after pacemaker implantation,thereafter pacemaker cardiac independently months ablation cox dimension left implantation block predict atrial la factors new every ventricular pacemaker documented without fibrillation could af multivariate analysis 219 180 884 higher rateonset newly ≥ rate 6 detected days vp significantly atrial year newatrial predicted risk larger heart ± morbidity patients bpm case regression,the maintenance of human atrial fibrillation,magnetic resonance imaging science ) exhibits public health relevance patient oriented research public health therapy design structural defect research proposals randomized trial pulmonary veinshuman atrial fibrillation maintenance,fibrillation atrial
74,341,735,strategy of pacemaker and electrode replacement for superior vena cava stenosis,electrode pacemaker cardiac cardiac ablation devices case block related replacement superior stenosis ventricular ii cava years fibrillation methodssuperior atrioventricular previously pacemakeratrial degree implantable device 10 cava year various stenosis implanted stenosed vena severe heart attempting type strategy,novel strategy for enhancing mirna as a therapeutic for cardiac regeneration,induced pluripotent stem cell cell fate control transduction efficiency transcription repressor transcription factor tlr3 gene subfamily lentivirinae sox6 gene signal transduction signal pathwaynovel strategy enhancing mirna cardiac regeneration therapeutic,cardiac strategy
75,224,555,beyond the wires: a case of leadless pacemaker-mediated tricuspid regurgitation,leadless degrees pacemaker cardiac ablation results clinical little block interaction factors • prognostic still ventricular unexpectedly likely lps relevant cause fibrillation apparatus lp significant beyondatrial subvalvular regurgitation year risk ppm wires implantation heart tricuspid impactmediated case,percutaneous left ventricular unloading for cardiogenic shock: beyond acute hemodynamic support,left ventricular assist device translational protein processing reactive oxygen species operative surgical procedures acute myocardial infarction transgene expression signal transduction preclinical study muscle cells mouse modelpercutaneous left ventricular unloading beyond acute hemodynamic support cardiogenic shock,ventricular
76,558,799,impact of covid-19 on pacemaker implant,pandemic periodpacemaker pacemaker covid cardiac 19atrial ablation implantation block impact implant including ventricular pacemaker 19 independent according mandatory fibrillation novo social atrioventricular previous period grade year covid period heart implants occurred case isolation,genetics of chronotype and impact on metabolic disease,genome wide association study dependent diabetes mellitus blood glucose regulation diabetes mellitus genetic association laboratory study epidemiology study signal transduction sample collection precision medicinemetabolic disease impact genetics chronotype,impact
77,551,963,micra-av leadless pacemaker and atrioventricular (dys)synchrony: a stepwise process,leadless pacemaker clock gene pacemakersav atrioventricular dys resulted synchrony mouse could activity pacemaker leading micra test cell reprogramming inadequate expression process transvenous due stepwise adequate guarantee process reports atrioventricularcircadian synchrony developed scn standard av rhythm pacemakers syndrome capable completing device exercise,deciphering mechanisms of vascular disease with cell and process specific ligands,derived growth factor beta receptor vascular smooth muscle cell proliferation vascular smooth muscle cell migration derived growth factor bb vascular smooth muscle derived growth factor smooth muscle myocytes public health relevance cell surface proteins operative surgical proceduresprocess specific ligands vascular disease deciphering mechanisms cell,cell
78,462,114,transvenous versus epicardial pacing in fontan patients,average pacing patients datum trends atrial received aspirin complications fontan two method toward pacemaker therapy epicardial except lead minor risk longer require patientscardiac high conclusion one transvenous 140 monthstransvenous crt occurred complication longevity year 2 followed one major patients pacemakers sensing versus warfarin device,ventricular and pulmonary vascular reserve after the fontan operation,low cardiac output patient outcomes assessments health care costs congenital heart disorder cardiac catheterization procedures exercise stress test chronic kidney failure central venous pressure patient care public healthpulmonary vascular reserve fontan operation ventricular,fontan
79,647,51,unusual lead helix damage due to selective reel syndrome,leads datum atrial generator selectivecardiac explanationunusual method pacemaker damage damaged therapy lead pulse risk around reel helix lead axis high conclusion . due crt possible year syndrome syndrome transverse device,the nanopore-based ion selective electrode vial,small business technology transfer research vitamin b complex chronic kidney failure complete blood count technology assessment whole blood waste products vial device thyroid gland systems integrationbased ion selective electrode vial nanopore,device
80,182,169,impact of early (<7 days) pacemaker implantation after cardiac surgery on long-term pacemaker dependency,pacemaker cardiac cardiac ablation confirmation 5 long implantation block dependency vsearly months ventricular pacemaker aortic dependency surgery warrant fibrillation 12 (> (< prospective among term ≥ % days year findings 7 permanent heart impactatrial (≥ survivors replacement early late valve case,epigenetic response to early life stress and the impact on cardiovascular health,low socioeconomic status gene expression regulation 18 year old life cycle stages substance abuse problem cardiovascular risk factor public health relevance early life stress cardiovascular disorder risk genome wide screenearly life stress epigenetic response cardiovascular health impact,year early
81,562,176,increased incidence of electrical abnormalities in a pacemaker lead family,intervention may insulation months leads demonstrated electrical datum surgical abnormalitiescardiac riskpacemaker ultimately 63 %) method pacemaker therapy 105 ) lead risk manifested increased 18 reflect median high conclusion tendril higher leads demonstrate crt follow significantly family findings represent failure required 7 year abnormalities followed 54 incidence early actively device,implementation adoption and utility of family history in diverse care settings,breast cancer risk factor clinical decision support systems hereditary neoplastic syndromes coronary heart disease electronic health record clinical decision support cost effectiveness analysis computerized medical record cardiovascular disorder prevention public health relevancediverse care settings family history utility implementation adoption,family risk
82,697,738,successful interventional management for pulmonary arterial injury secondary to pacemaker implantation,may datum implantation puncture access subclavian method pacemaker therapy risk specific transcatheter lead high conclusion interventional secondary vein leadspulmonary implantationcardiac crt presentation management arterial embolization along year pa injury implantation clinical successful device,targeting of apoptotic and autophagy pathways for treatment of pulmonary arterial hypertension (pah),vascular smooth muscle cell proliferation smooth muscle myocytes cell culture techniques small interfering rna pulmonary artery structure derived growth factor pulmonary arterial hypertension endothelin receptor antagonist pulmonary heart disease cell proliferationpulmonary arterial hypertension autophagy pathways treatment targeting pah apoptotic,arterial
83,504,503,magnetic resonance imaging in patients with cardiac implanted electronic devices: focus on contraindications to magnetic resonance imaging protocols,defibrillator focus changed pacemaker cardiac occurrence slightly cardiac events devices leadscardiac patients ablation block pacing complications either ventricular contraindicationsatrial without fibrillation resonance requiring magnetic rate implantable batteries year depleted occurred mri implanted protocols electronic inexplicably heart abandoned parameters imaging imaging adverse major cardioverter case device,a new paradigm for rapid accurate cardiac magnetic resonance imaging,computerized data processing research clinical testing magnetic resonance imaging cardiovascular diagnostic techniques magnetic resonance imaging techniques research study cardiovascular diseases invasive imaging imaging technologyaccurate cardiac magnetic resonance imaging new paradigm rapid,imaging cardiac resonance magnetic
84,290,685,pyloric obstruction secondary to epicardial pacemaker implantation: a case report,wallpyloric pyloric minute normal aortic old surgical block left implantation reportvalve outcome apso outflow resulted 200 pacemaker group epicardial appeared without lhasa immediate h post risk 12 noted atrioventricular 40 wall obstruction escape high ventricular grade case degree beats secondary year intermittent complications implanted high year tavr per dog tract mortality rhythm second abdominal,microbubble-medicated ultrasonic therapy for microvascular obstruction,vascular smooth muscle signal recognition particle public health relevance arterial fatty streak percutaneous coronary intervention ultrasound biological effect coronary heart disease acute myocardial infarction heart damage ultrasonic therapymedicated ultrasonic therapy microvascular obstruction microbubble,obstruction
85,907,480,successful inferior vena cava filter removal using pacemaker lead extraction methods,laser novel may pacemaker cardiac patient ablation injurious filters block remove technique filter removal sheath filterssuccessful ventricular pacemaker using extraction mechanical lead fibrillation cause methodsatrial 12 fr problematic telescoping cava year ivc complications tools vena using heart sheath inferior difficult case become,statistical and computational methods for large-scale sequencing studies,adult respiratory distress syndrome genome wide association study hispanic community health study user friendly software obstructive sleep apnea gene environment interaction dependent diabetes mellitus acute lung injury public health schools next generation sequencingscale sequencing studies computational methods statistical large,
86,727,598,gene delivery for the generation of bioartificial pacemaker,action limited bioartificial transfer muscle pacemaker aortic implantation block battery cardiomyocytes gated outcome rhythm responsesgene pacemaker disorders group delivery channel risk protein gene somatic porcine potentials complete high ventricular strategically establishing engineered rhythmically form autonomic sinus year sick tavr heart fire generationvalve life mortality syndrome neurohumoral via models,generation of genetically engineered hamsters for circadian studies,reverse transcriptase polymerase chain reaction quantitative reverse transcriptase pcr jet lag syndrome hamster cell line nervous system disorder disorder risk transgenic organisms suprachiasmatic nucleus study models sleep syndromegenetically engineered hamsters circadian studies generation,models engineered risk syndrome
87,827,80,direct powering a real cardiac pacemaker by natural energy of a heartbeat,yet storage direct pacemaker inevitable effective cardiac aortic devices composites implantation impressive powered outcome heartbeatvalve two every toward element group risk years 12 although fabricating 5 high energy implantable external device several step piezoelectric year therapeutic tavr energy mortality effectively approaches natural medical powering duereal,a natural history study of novel biomarkers in pulmonary arterial hypertension,united states national institutes synthetic polymer bioplex ray computed tomography pulmonary arterial hypertension primary pulmonary hypertension institutional review boards hereditary hemorrhagic telangiectasia cell free dna pulmonary function tests new therapeutic targetpulmonary arterial hypertension natural history study novel biomarkers,therapeutic natural
88,426,982,permanent pacemaker implantation after pediatric heart transplantation: risk factors indications and outcomes,oht placement pacemaker cardiac patient dysfunction ablation transplant recovered block implantation chb pacing factors ventricular pacemaker transplantation fibrillation complete undergoing node ppm recipients sinus year risk orthotopic recordspermanent pediatric 15 vs indicationsatrial heart often outcomes heart rhythm patients following adults increased case medical group,improving outcomes after pediatric cardiac arrest,cardiac intensive care unit pediatric intensive care units intensive care units environmental air flow congenital heart disorder cluster randomized trial american heart association public health relevance public health critical carepediatric cardiac arrest improving outcomes,cardiac pediatric outcomes heart
89,207,740,pacemaker lead as an iatrogenic cause of right heart failure: case report,echocardiography aortic patient cause ultrasound postoperative surgical revealed block left reportvalve function implantation outcome right symptomatic regurgitation homogeneous ringright pacemaker group annuloplasty echocardiogram dilated risk atrioventricular lead iatrogenic complete high invasive ventricular fatigue case preserved treatment minimally transesophageal progressively regurgitation failure reported year tavr heart severe hepatomegaly showed tricuspid mortality worsening progressive chambers slightly abdominal,exercise training in heart failure: structural and functional cardiac remodeling,left ventricular ejection fraction converting enzyme inhibitors left ventricular structure systolic heart failure public health relevance heart failure protocols documentation pilot projects physical function patient ambiguityfunctional cardiac remodeling heart failure exercise training structural,failure function heart left patient ventricular
90,807,843,induced cardiac pacemaker cells survive metabolic stress owing to their low metabolic demand,pacemaker investigate exhibiting native cardiac myocytes clock cells low gene protein mouse activity pacemaker comparative insult metabolic cell expression sinoatrial node upon higher stress owing survive mitochondrial viability oxidative scn cell induced inner myocytes initiate demandinduced cells differences withstand rhythm stress generated fusion demandcircadian membrane,metabolic regulation of o-glcnac and cardiac function during hypertrophy,high pressure liquid chromatography translational protein processing public health relevance aortic valve stenosis transgenic organisms signal transduction risk factors mouse model mass fragmentography functional outcomesmetabolic regulation cardiac function hypertrophy glcnac,cardiac protein mouse
91,793,616,prognostic significance of non-sustained ventricular tachycardia on stored electrograms in pacemaker recipients,pacemaker episodes cardiac dysfunction ablation case left block least electrograms prognostic myocardial sustained ventricular whereas pacemaker ) infarctionsustained fibrillation 1 included 87 univariate lower ejection ventricular 3 node nonatrial age interrogations episode previous recipients sinus year tachycardia stored heart slightly fraction arrhythmic significance device analysis group,prognostic significance of microrna expression in children with cardiomyopathy,new therapeutic target 1 year old systolic heart failure pediatric heart failure heart failure pediatric cardiomyopathy pediatric cardiologist national heart untranslated rna treatment planningprognostic significance microrna expression children cardiomyopathy,significance year 1 heart
92,877,773,plasma exchange for urgent apixaban reversal in a case of hemorrhagic tamponade after pacemaker implantation,effect intervention therapies underwent aortic patient pericardial old week surgical implantation prevented apixaban facilitated outcome hemorrhagic pacemaker group anticoagulant risk exchange high exist reverse effusion pericardiocentesis xa possible tamponade year man tavr plasma mortality one occurred anticoagulationurgent reversal casevalve,cardiac mr imaging of hemorrhagic reperfusion injury after myocardial infarction,left ventricular function magnetic resonance imaging left ventricular remodeling percutaneous coronary intervention high risk population acute myocardial infarction ventricular remodeling high prevalence invasive imaging imaging modalityhemorrhagic reperfusion injury cardiac mr imaging myocardial infarction,intervention high risk
