,pubMed,clinicTrial,pubMed_Title,pubMed_keywords,clinicTrial_Title,clinicTrial_keywords,keywords_common
123,814,43,conduction recovery following pacemaker implantation after transcatheter aortic valve replacement,consecutive 30 datum prior implantation block replacement ). method aortic pacemaker pconduction therapy without ) recovery risk days (< transcatheter escape complete undergoing high conclusion ventricular within ppm 67 expandable crt 594 10 days % persistent stenosis year tavr severe new av treat replacementcardiac patients following rate 4 valve device,mechanistic evaluation of the role of circadian rhythms in acute lung injury and subsequent recovery,jet lag syndrome viral load result cell cycle regulation novel therapeutic intervention acute lung injury cell death circadian regulation signal transduction risk factors regenerative capacityacute lung injury subsequent recovery mechanistic evaluation circadian rhythms role,recovery risk
124,93,511,slow wave activity and modulations in mouse jejunum myenteric plexus in situ,action % study pacemaker showed cardiac situ capsaicin patch ablation block potential preparation clamp ventricular activity pacemaker tetrodotoxin provides fibrillation situ interstitial 40 modulationsatrial plexus potentials hyperpolarized potentialmouse 10 jejunum slow myenteric year oxide nitric neurons cells ganglion heart evocable ± plexus wave depolarized embedded resting shape electrically case membrane,in vitro and in situ engineering of fibroblasts for cardiac repair,induced pluripotent stem cell human embryonic stem cell pluripotent stem cells linked immunosorbent assay science ) engineering stem cells cell type cell therapy human engineering electrical engineeringsitu engineering cardiac repair vitro fibroblasts,cells cardiac
125,287,913,malignant ventricular tachycardia and cardiac arrest induced by a micra™ leadless pacemaker,leadless pacemaker effusion cardiac cardiac ablation case pericardial ™ implantation block ventricular pacemaker represents part serious fibrillation malignant ventricular implanted important arrest year tachycardia increasing induced implantation arrestmicra heart advancement adverse major inducedatrial effects complication associated,minimallyâ invasiveâ cardiacâ sympathetic denervation for malignant ventricularâ arrhythmia,environmental air flow thoracic surgical procedures operative surgical procedures radiofrequency interstitial ablation radiofrequency catheter ablation structural heart disease sympathetic nerve block nervous system structure nervous system disease rateminimallyâ invasiveâ cardiacâ sympathetic denervation malignant ventricularâ arrhythmia,block malignant heart ablation
126,961,273,pathological changes secondary to pacing leads within the coronary veins,inflammatory pacemaker leads clock macroscopically veinscircadian channels gene changes pacing coronary mouse activity chronic veins withinpathological histologically cell included expression within formed leads secondary foreign like bland body scn slit smaller sheaths rhythm around fibrosis response destruction fibrous longstanding veins,compartmental pka and pathological cardiac hypertrophy,aortic valve stenosis dependent protein kinases protein kinase protein isoforms protein inhibition protein activation united states transgenic organisms transgenic mice signal transductionpathological cardiac hypertrophy compartmental pka,
127,335,471,ventriculoatrial synchrony induced heart failure,desynchronization pacemaker clock forms gene arrhythmia mediated reentrant synchrony mouse two activity loop non cell atrioventricular expression ventriculoatrial reverse failurecircadian impulse endless repetitive rnrvas tachycardia synchrony objectiveventriculoatrial scn induced heart rhythm,investigating peripheral circadian rhythm synchrony in alzheimers disease,environmental risk factor early detection biomarkers sleep wake cycle new therapeutic target suprachiasmatic nucleus sleep abnormalities protocols documentation positioning attribute older patient neurodegenerative disordersinvestigating peripheral circadian rhythm synchrony disease alzheimer,synchrony rhythm
128,948,892,alternate method for endocardial pacemaker lead implantation: a hybrid mini-thoracotomy approach,fluoroscopy approach pacemaker minimal clock report implantation low gene mini thoracotomy methodcircadian mouse compatible focuses activity pacemaker cardial lead alternate approachendocardial cell stay expression rates subclavian endocardial case via vein guided axillary placement mri complication hybrid scn hospital implantation routes rhythm early,development of an advanced cryothermal ablation catheter and method for treating cardiac arrhythmias,sudden cardiac death ventricular tachycardia ventricular fibrillation treatment strategy treatment protocols toxic effect tissue model survival rate research institute procedural painadvanced cryothermal ablation catheter treating cardiac arrhythmias method development,
129,857,531,cardiac interventions in pregnant patients without fluoroscopy,system selected underwent jude pacemaker system cardiac electroanatomic . clock patients report block gene three pregnancy mouse symptomatic activity using quadripolar without carry performed structure cell riskspregnant geometries expression complete significant mn ensite interventionscircadian deflectable reviews electrophysiology guidance catheter scn necessary diagnostic using av mapping one rhythm catheterization patients fluoroscopy inc pregnant medical,multiscale modeling of inherited cardiomyopathies and therapeutic interventions,myosin regulatory light chains wild type mouse magnetic resonance imaging dna sequence alteration genetic regulatory protein myosin atpase treatment planning treatment optimization treatment failure transgenic micetherapeutic interventions multiscale modeling inherited cardiomyopathies,mouse
130,944,325,long-term risk of heart failure and mortality following mitral valve surgery in patients with and without right ventricular pacemaker,pacemaker fraction mortality results 30 patients datum left 63 mitral 68 right method pacemaker therapy longcardiac surgery without risk years days ) %) systolic ejection 11 ventricular ischemic undergoing high conclusion within ppm term crt surgery disease reduced rv placement failure developed implanted year vs heart often hfmortality patients following repair valve device,comprehensive assessment of right ventricular and pulmonary vascular function via ct imaging in heart failure patients,left ventricular assist device ray computed tomography pulmonary artery structure operative surgical procedures right ventricular structure right ventricular dysfunction magnetic resonance imaging right ventricular function research project grants patient oriented researchpulmonary vascular function via ct imaging heart failure patients right ventricular comprehensive assessment,failure device heart patients left ventricular right
131,220,582,fistula formation 6 years after removal of infected pacemaker leads,suspected pacemaker cardiac ablation surgical gland block formation two ventricular pacemaker fragment lead reason removalatrial periods fibrillation underneath sebaceous unsuccessful hypothesis leads 6 treatment possible working years present year patientfistula permanent heart small infected six initial admission case male,sudep research alliance: ipsc and mouse neurocardiac models application 6 of 7,induced pluripotent stem cell public health relevance ekg p wave heart rate variability vagus nerve structure heart cell cell model nerve supply sudden death spinal gangliasudep research alliance mouse neurocardiac models application 6 ipsc 7,heart 6
132,435,160,bone morphogenetic protein 4 promotes the differentiation of tbx18-positive epicardial progenitor cells to pacemaker-like cells,positive gata novel pacemaker differentiationvalve mechanisms aortic 4 implantation studybone outcome tbx18 pacemaker group epicardial risk bone protein although high tbx18 (+) present morphogenetic regulatory like epcs year promotes tavr binding identifying cells )(+) targets mortality 4 progenitor,regulation of epicardial cell differentiation during development and disease,wnt signaling pathway public health relevance novel therapeutic intervention new therapeutic target smooth muscle myocytes gene expression profile serum response factor multipotent stem cells cell differentiation process gene expressionepicardial cell differentiation regulation disease development,cells novel
133,639,977,silent atrial fibrillation in elderly pacemaker users: a randomized trial using home monitoring,pacemaker cardiac usersatrial ablation patients case left block remote atrial three fibrillationrandomized ventricular pacemaker hundred elderly detect monitoring fibrillation days recurrence end monitoring detection continuous days point primary trial year recurrence af diameter allows vs points home using heart silent capabilities 54 early 100 secondary,smartwatch monitoring for atrial fibrillation after stroke,united states national institutes transient ischemic attack vulnerable populations smartphone application signal transduction signal processing self efficacy physiologic pulse patient representative patient caresmartwatch monitoring atrial fibrillation stroke,monitoring fibrillation atrial
134,141,143,influence of frailty on the quality of life patients qualified for pacemaker implantation,study influence may selected cardiology worse 60 datum implantation reduce influences method pacemaker using therapy quality questionnaire risk frailty qualified evaluation included high conclusion invasive prospective node frailtycardiac ≥ crt affects years sinus 171 dysfunctionlife centre year study whether implantation using mlhf procedures tilburg patients syndrome indicator aged device,epigenetic influence on thyroid hormone action in the brain and on behavior,genome wide association study attention deficit hyperactivity disorder nervous system physiology environmental risk factor nervous system disorder autism spectrum disorder gene expression profiling candidate disease gene gene expression neurodevelopmental disorderthyroid hormone action epigenetic influence brain behavior,influence study risk
135,71,149,transcutaneous pacing of a 4-year-old child,literature usually pacemaker cardiac ablation old block child including congenital presentstranscutaneous ventricular pacemaker fibrillation require block complete 4atrial case emergency behind external interventions owing dependent year complications requiring year abnormalities heart often heart pacing case,neuromodulation of the brain-gut axis by transcutaneous vagal nerve stimulation in functional dyspepsia,midbrain central gray substance upper digestive tract structure functional magnetic resonance imaging operative surgical procedures heart rate variability functional gastrointestinal disorders dorsal motor nucleus galvanic skin response vagus nerve structure liquid substancetranscutaneous vagal nerve stimulation gut axis functional dyspepsia neuromodulation brain,heart
136,773,469,sex and permanent pacemaker implantation after surgical aortic valve replacement,estimated disturbances scoressurgical 30 datum implantation surgical expands propensity replacement method national pacemaker aortic therapy risk swedish transcatheter high conclusion within crt days health permanent requiring year implantation sexcardiac conduction replacement valve device,engineering an aortic heart valve with cellular and mechanical functionality,three dimensional cell culture induced pluripotent stem cell three dimensional structure ray computed tomography operative surgical procedures congenital heart defects heart valve diseases mesenchymal stem cells cardiac tissue engineering like cellaortic heart valve mechanical functionality engineering cellular,surgical valve
137,759,874,new onset cardiac arrhythmias after metabolic and bariatric surgery,underwent pacemaker . cardiac clock improve data gene bradyarrhythmias texas mouse ). public metaboliccircadian activity pacemaker bariatric inpatient surgery problems state cell expression installation case differences file large across area contains use reports sinus placement arrhythmias database onset scn sick e administrative syndrome patients rhythm insertionnew undergo medical,camkii signaling in physiology heart failure and arrhythmias,2 +)- calmodulin dependent protein kinase reactive oxygen species derived neurotrophic factor metabolic abnormality assessment protein isoforms weight gain skeletal muscle signal transduction pathway interactions oxidative stressheart failure camkii signaling physiology arrhythmias,arrhythmias
138,974,666,dynamics of a neuronal pacemaker in the weakly electric fish apteronotus,oscillator action towards pacemaker cardiac population ablation normal based connectivity block function dynamicsatrial apteronotus neuronal weakly ventricular pacemaker first discharge manipulationsweakly channel junctional fibrillation electric organ neuron fish testing averaging dynamics year step different brain known exhibited heart precise potential oscillating biological fish required experimental case gap,electric studies of excitation secretion & contraction,science ) endocrine glands high pressure liquid chromatography mass spectrum analysis jet lag syndrome second messenger systems sympathetic nervous system cell culture techniques messenger rna cell type cell lineelectric studies secretion excitation contraction,
139,154,233,potential effects of intrinsic heart pacemaker cell mechanisms on dysrhythmic cardiac action potential firing,action activity mechanisms cardiac clock cells electrical effectscardiac datum dysrhythmic connectionsintrinsic method activity pacemaker therapy molecular risk clocks release firing neurotransmitter lead may sinoatrial high conclusion spontaneous node within specialized rate regular crt alternation residing brain year cell heart cells potential brady via device,ovarian effects on intrinsic connectivity and the affective enhancement of memory,heart rate variability galvanic skin response negative emotional state traumatic stress disorders mood disorders negative mood traumatic event targeted treatment supply inventories sex characteristicsovarian effects intrinsic connectivity affective enhancement memory,rate heart
140,359,49,novel atrioventricular sequential pacing approach using a transvenous atrial pacemaker and a leadless pacemaker: a case report,echocardiography leadless mechanisms pacemaker woman cardiac ablation leads presented team old revealed block atrial pacing meeting ventricular dysfunction using disciplinary neck sequential years fibrillation 14 ago pulsations atrioventricular lead reportatrial across case node significant transvenous several regurgitation sinus approach year developing valvenovel severe heart av tricuspid including postural case,improving cardiac rehabilitation outcomes using data from daily life: a novel multi-method ambulatory assessment approach,heart rate monitor health related quality ecological momentary assessment united states traumatic injury social support social interaction predictive marker precision medicine person centeredimproving cardiac rehabilitation outcomes using data method ambulatory assessment approach daily life novel multi,approach cardiac using heart
141,978,358,left ventricular synchrony with septum stimulation vs. septal ventricular outflow tract in complete atrioventricular block,study electrode analytical old septum datum observational left electrode pacing right placementseptal synchrony outflow blockcardiac method therapy characteristics risk years atrioventricular 18 complete high conclusion ventricular stimulation regardless vs demographic crt synchrony cross tract year similar device,role of delta-like ligand-4 signaling in cardiac outflow tract development,double outlet right ventricle transforming growth factor beta series research career programs fibroblast growth factor public health relevance operative surgical procedures neural crest cell branchial arch structure congenital heart disorder congenital heart defectscardiac outflow tract development like ligand 4 signaling role delta,right outflow tract
142,963,878,apparent pacemaker dysfunction during peptide receptor radionuclide therapy for neuroendocrine tumor,may thresholds dysfunction shifts datum receptor pacing electrolyte method pacemaker therapy casepeptide radionuclide changes risk cause causes rare apparent high conclusion neuroendocrine crt year reversible tumorcardiac reminder device overlook,the role of kisspeptin and rfrp-3 in the neuroendocrine control of female reproduction,designer receptors exclusively activated gonadotropin hormone releasing hormone small hairpin rna polycystic ovary syndrome luteinizing hormone designer drugs translational impact transgenic mice suprachiasmatic nucleus spontaneous abortionneuroendocrine control female reproduction role rfrp kisspeptin 3,
143,136,935,bradyarrhythmias and pacemaker indications in elderly patients,mode approach increasepacemaker patient dysfunction patients datum bradyarrhythmiascardiac pathology pacemaker method therapy characteristics elderly personnel risk special considerations health high conclusion node selection crt people sinus indivualised underlying indications permanent care year required device group dramatic,aspirin in reducing events in the elderly,65 +) impaired cognition blind placebo controlled trial mild cognitive impairment human old age risk benefit ratio cardiovascular disorder prevention coronary heart disease heart disease prevention prevention trial blind methodreducing events elderly aspirin,elderly risk
144,242,992,the development of yellow nail syndrome after the implantation of a permanent cardiac pacemaker,pacemaker cardiac cardiac developmentatrial ablation experienced implantation block rheumatoid ventricular pacemaker fibrillation conditions recently nail titanium exposure subclinical yellowish authors underlying various year yellow permanent timely diagnosisyellow heart arthritis nails syndrome made case,understanding mitochondrial regulation of cardiac development and function through studies of barth syndrome,methylglutaconic aciduria type 2 induced pluripotent stem cell reactive oxygen species public health relevance online mendelian inheritance translational protein processing inner mitochondrial membrane left ventricular non protein kinase protein complexunderstanding mitochondrial regulation cardiac development barth syndrome studies function,cardiac ventricular syndrome
145,735,39,pacemaker implants in children and adolescents with chagas disease in brazil: 18-year incidence,performed pacemaker cardiac cardiac ablation electrocardiographic implantation block brazil public ventricular pacemaker continues serious children fibrillation health implants undergone chagas stimulation device main registry disease younger year problem adolescents stimulationyear database 123 findings heart implants disease brazilian patients incidence aged case 18atrial,proteomic profiles and cardiac dysfunction in children and adolescents with hiv,united states national institutes magnetic resonance imaging health care availability national heart imaging biomarker heart imaging treatment program prospective studies phenotypic biomarker pathway interactionsproteomic profiles cardiac dysfunction hiv children adolescents,cardiac children health heart adolescents
146,896,130,connectivity of pacemaker neurons in the neonatal rat superficial dorsal horn,horn circuits lamina pacemaker activity cardiac ablation ramified block multiple patch ventricular pacemaker whereas indicated ipsilateral pathways periaqueductal intact fibrillation virus superficial neurons combines gray within contact rat large cord motor present neuronsneonatal year axons spinal prv neonatal study contacted pseudorabies neurons connectivityatrial possessed heart dorsal small synaptic case,ovarian effects on intrinsic connectivity and the affective enhancement of memory,heart rate variability galvanic skin response negative emotional state traumatic stress disorders mood disorders negative mood traumatic event targeted treatment supply inventories sex characteristicsovarian effects intrinsic connectivity affective enhancement memory,heart
147,601,862,interaction of membrane and calcium oscillators in cardiac pacemaker cells: mathematical modeling,oscillator action pacemaker ). cardiac cardiac +)- clock cells outer case ablation block ( channels calcium interactionatrial two ventricular pacemaker intracellular modeling oscillators mathematical provides fibrillation even generation oscillators sensitive year units withincardiac 2 membrane cells heart stable potential release concentration cellular oscillator membrane,cardiac interaction networks as determinants of transcriptional specificity,nucleic acid regulatory sequences liquid chromatography mass spectrometry atrial heart septal defects heart septal defects holt oram syndrome structural congenital anomalies congenital heart disorder septal defect congenital abnormality heart abnormalitiescardiac interaction networks transcriptional specificity determinants,heart
148,432,774,pacemaker pocket stabilization utilizing a novel envelope and a three-point anchoring technique,novel symptoms sided pacemaker aortic . presented old dual left stabilization implantation three outcome superior reinforce group along silver aziyo surrounding stabilitypacemaker pocket risk cava man point biologics high envelope pocket immediately threevalve possible spring persistent forming suture abated infection year anchoring tissue utilizing tavr technique vena mortality indolent inc vascularized silk device chamber,mechanisms of anti-inflammation and membrane stabilization in muscular dystrophy,muscular dystrophy mouse model duchenne muscular dystrophy primary myocardial diseases next generation sequencing live cell imaging mutant strains mice mouse model next generation muscular dystrophies muscular atrophymuscular dystrophy membrane stabilization mechanisms inflammation anti,stabilization
149,871,619,lateral thoracotomy for epicardial pacemaker placement in patients with congenital heart disease,cardiac tissue datum prior revisions atrial least including achieve inherited congenital %) method 19 pacemaker therapy epicardial thoracotomy lead ) risk 49 years 20 operation arrhythmia 1 lateral patientscardiac median high conclusion ventricular pocket leads 17 crt 10 adequate years scar syndromes placement disease device year heart attempted avoiding including pacemakers syndromesepicardial pacing age,the genomic basis of congenital heart disease and neurodevelopmental outcomes,functional magnetic resonance imaging genome wide association study magnetic resonance spectroscopy magnetic resonance imaging copy number polymorphism congenital heart defects public health relevance chromatin remodeling factor cell differentiation process cardiac surgery procedurescongenital heart disease neurodevelopmental outcomes genomic basis,disease cardiac congenital heart
150,396,416,prevalence of and risk factors for permanent pacemaker implantation after aortic valve replacement,system whole intervention may aortic cardiac percutaneous affect implantation tavr elective factors outcome savr coronary replacement ). artery pacemaker aortic group grafting <. without risk logistic analysis preoperative p concomitant included undergoing high multivariable disturbances importantly savr risk prevalencevalve bypass requiring permanent qualitypermanent year tavr vs 0001 using conduction mortality 5807 patients group valve regression identified,innate and adaptive immune-cell densities as risk factors for heart failure,peripheral blood mononuclear cell specific qualifier value operative surgical procedures congestive heart failure immune cell activation experimental animal model natural killer cells coronary heart disease novel therapeutic intervention left ventricular dysfunctionrisk factors heart failure cell densities adaptive immune innate,coronary factors intervention
151,79,932,role of i(f) density on electrical action potential of bio-engineered cardiac pacemaker: a simulation study,action study pacemaker inevitable cardiac datum electrical genetically manipulating potential biocardiac could method pacemaker therapy non risk density simulation studies alternative high conclusion suppressingengineered f implantable crt previous failure pacemaking year heart cells biological experimental drawbacks role device,estrogen receptor-alpha effects on right ventricular vascular density and angiogenesis in pulmonary hypertension,bone morphogenetic protein receptors chronic obstructive airway disease sleep apnea syndromes gonadal steroid hormones right ventricular hypertrophy right ventricular dysfunction new therapeutic target estrogen receptor alpha pulmonary artery structure right ventricular functionright ventricular vascular density pulmonary hypertension estrogen receptor alpha effects angiogenesis,density
