,pubMed,clinicTrial,pubMed_Title,pubMed_keywords,clinicTrial_Title,clinicTrial_keywords,keywords_common
93,746,404,leadless pacemaker implantation in a pediatric patient with prolonged sinus pauses,leadless system may prolonged underwent pacemaker develop cardiac patient cardiac percutaneous ablation devices ™ old implantation block pacing related complications symptomatic ventricular rise problems pacemaker documented patientatrial lead bradycardiaprolonged fibrillation undergoing conventional patient device sinus year pediatric permanent heart pauses micra patients pacing case,ecpr after prolonged cardiac arrest: targeting mechanisms of the no-reflow,united states national institutes extracorporeal membrane oxygenation nervous system physiology blood coagulation disorders randomized clinical trials coagulation process clinical trials cardiovascular system cardiovascular physiology blood circulationprolonged cardiac arrest targeting mechanisms reflow ecpr,system cardiac
94,267,336,traumatic fracture of pacemaker lead by suture transfixation to pectoral muscle,knots aortic leadvalve sleeve report implantation outcome tying pacemaker group lead risk tightly transfixation lead pectoral high acute fracture without avoidtraumatic suggest result suture might muscle year vigorously tavr damage suturing mortality,breathing meditation intervention for post traumatic stress disorder,randomized controlled clinical trials public health relevance psychology ) data autonomic nervous system traumatic stress disorders heart rate variability evidence based treatment health care service heart rate traumatic eventpost traumatic stress disorder breathing meditation intervention,
95,110,221,heart failure provoked by a pacemaker lead-induced tricuspid stenosis,obstruction extrinsic valvuloplasty aortic percutaneous leadvalve implantation outcome multiple intramyocardial stenosis balloon pacemaker group lead position risk inflow tissueinduced high ventricular leads due stenosis provoked year tavr heart tricuspid mortality failure valve iatrogenic,regulation of cardiac metabolism and heart failure by tristetraprolin,reactive oxygen species mrna transcript degradation public health relevance metabolic abnormality assessment fatty acid oxidation fatty acid metabolism fatty acids oxygen consumption mrna stability mrna expressionheart failure cardiac metabolism tristetraprolin regulation,failure
96,632,736,a screening of unf targets identifies rnb a novel regulator of drosophila circadian rhythms,drosophila novel circadian pacemaker provide cardiac . 2012 ablation case block top immunoprecipitation comprising chromatin jaumouillé functionally ). identifies 2016 ventricular unf pacemaker additional ) subgroups fibrillation 2015 gene genes results targets evidenceunf newly target acts regulator screeningatrial beuchle 2016 diverse rnb year different classes downstream multioscillator rnb circuit et using rhythms heart al networks lee identified,circadian rhythms and cardiovascular risk,continuous positive airway pressure public health relevance sleep wake cycle sudden cardiac death heart rate variability autonomic nervous system cardiovascular risk factor cardiovascular disorder risk sleep apnea syndromes obstructive sleep apneacircadian rhythms cardiovascular risk,cardiac rhythms heart
97,888,308,risk for complications after pacemaker or cardioverter defibrillator implantations in patients with myotonic dystrophy type 1,frequent selected pacemaker patients 5 datum sudden defibrillator myotonic dm1 complications method therapy ) risk retrospectively years 914 death pmyotonic high conclusion among prevention 6 hospitalisation implantable crt dystrophy % implantations 1 device 23 complicationscardiac requiring year heart defibrillators type follow cardioverter however registry,mis-splicing of scn5a and its effect on the heart in myotonic dystrophy,clustered regularly interspaced short palindromic repeats science ) etiology small nuclear rna voltage gated channel sodium channel blockers sudden cardiac death sodium channel rna splicing messenger rna therapeutic targetmyotonic dystrophy splicing scn5a mis heart effect,sudden dystrophy heart ) death
98,395,244,opening the schrödinger box: short- and long-range mammalian heart rate variability,mechanisms interactions system aortic . nervous intrinsic systems implantation opening internal outcome pacemaker group ) risk ans ) box e high backgroundrange endocrine schrödinger short rate autonomic year tavr heart variability longvalve mortality mammalian g govern,development and pilot investigation of heart rate variability biofeedback for smoking cessation,randomized controlled trials heart rate variability informal social control smoking cessation intervention smoking cessation therapy design smoking prevalence smoking intervention smoking addiction secondary analysisheart rate variability biofeedback smoking cessation pilot investigation development,variability rate heart
99,22,986,analysis of pacemaker ecgs,ecgs mode contractions pacemaker pvc delay automatic algorithms cardiac ablation systematic block pacing always tachycardia ventricular pacemaker ecgpacemaker loop window ) modifying switching analysisatrial ecg junctional fibrillation specific almost escape ventricular safety malfunction premature endless year approach allows used heart av rhythm pacing case,rhythmic circadian network analysis,jet lag syndrome novel imaging technology metabolic syndrome signal transduction psyche structure personal satisfaction pathway analysis nodal myocyte neural circuit mood disordersrhythmic circadian network analysis,
100,851,810,familial clustering of cardiac conduction defects and pacemaker insertion,defects cardiac electrocardiographic datum insertion block bundle ). method pacemaker therapy ) adjusted risk logistic atrioventricular registries complete branch population clusteringcardiac high investigated conclusion framingham degree crt parental year study clustering defectscardiac heart branch administrative conduction general danish familial nationwide device regression models,pre-vascularized and degradable patches for correction of congenital heart defects,amniotic fluid derived stem cell stem cell differentiation public health relevance magnetic resonance imaging muscle satellite cell operative surgical procedures cardiac surgery procedures congenital heart defects sudden cardiac death right ventricular structurecongenital heart defects degradable patches vascularized pre correction,cardiac defects heart
101,797,481,utility of transthoracic impedance and novel algorithm for sleep apnea screening in pacemaker patient,positive novel pacemaker cardiac characteristic ablation case operating receiver apnea index block disturbance algorithm impedance ). ventricular pacemaker impedance diagnosis respiratory fibrillation could transthoracic value correlationsleep optimal scan screening patient sleep sensor best utilityatrial year cutoff heart ap apnea algorithm strong identify,human heart-on-a-chip for screening cardiomyopathy and chemotherapeutic cardiotoxicity,induced pluripotent stem cell stem cell differentiation binding protein c disease mechanisms study protein isoforms toxic effect tissue model tissue engineering stem cells pharmaceutical preparationsscreening cardiomyopathy human heart chemotherapeutic cardiotoxicity chip,heart
102,550,988,superior vena cava syndrome after pacemaker implantation treated with direct oral anticoagulation,direct central treated pacemaker cardiac ablation devices case implantation block wires common oral superior ventricular increasingly pacemaker lead cava catheters fibrillation collateral ) injury intravascular transvenous vein causessuperior becoming possible adequate cava year mainly vena implantation heart syndrome venous intimal circulation anticoagulationatrial iatrogenic benign,optimal anticoagulation strategies for acute atrial fibrillation,integrated health care systems series research career programs health care costs emergency department visit emergency department physician emergency department evaluation emergency department patient emergency department emergency care patient careoptimal anticoagulation strategies acute atrial fibrillation,fibrillation
103,65,777,global health resource utilization associated with pacemaker complications,infections pacemaker complicationscircadian insulation regionsglobal clock implantation gene least three thrombosis replacement mouse activity pacemaker upper chronic utilization typical health resource cell expression intensive utilization across estimate complications deep requiring scn similar extremity estimating rhythm venous extraction breaches complication associated,miniaturized global coagulation assay system in neonatal and pediatric settings,small business innovation research grant coronary heart disease comb animal structure neonatal intensive care blood coagulation disorders clinical research hemorrhagic disorders blood coagulation signal transduction pharmaceutical preparationsminiaturized global coagulation assay system pediatric settings neonatal,intensive
104,126,451,a complex case of pacemaker lead endocarditis,bacteremia caseatrial pacemaker showed since 2007 patient subsequent cardiac ablation block infective internal multiple ventricular pacemaker endocarditis leadspacemaker lead echocardiogram electrocardiogram complex fibrillation organ acute malfunction images transesophageal department year related failure renal developed compatible medicine staphylococcus heart aureus case chamber,genomic basis of phenotypic variability of complex disorders,nucleic acid regulatory sequences intellectual functioning disability copy number polymorphism smith magenis syndrome public health relevance congenital heart disorder genetic disorder diagnosis candidate disease gene williams syndrome heart diseasesphenotypic variability genomic basis complex disorders,complex heart
105,181,940,clinical application of one-stage operation of epicardial permanent pacemaker implantation and cardiac surgery,approach cardiac onecardiac chest wound 5 datum implantation surgical atrial including right coronary replacement method artery pacemaker therapy epicardial grafting surgery risk stage incision electrodes operation included median high conclusion simultaneous ventricular procedures infection crt application bypass permanent year 15 clinical valve device occurredepicardial,the cardiac na-ca exchanger: defining the mechanisms of its operation and regulation,science ) experimental study fluorescence resonance energy transfer public health relevance membrane transport proteins ion transport research proposals protein region protein isoforms pharmaceutical preparations pathway interactionscardiac na ca exchanger regulation operation mechanisms defining,operation
106,618,872,chronic performance of subxiphoid minimally invasive pericardial model 20066 pacemaker lead insertion in an infant animal model,model available showed subxiphoid pacemaker clock pericardial insertion implantation gene fibrovascular sites impedance mouse commercially activity pacemaker chronic epicardial impedance lead performancecircadian thresholdssubxiphoid cell expression lead medtronic median fixation model capture invasive ventricular infant minimally placement 20066 1 scn proliferation rhythm change threshold animal,affecting gene expression in the placenta in an animal model,clustered regularly interspaced short palindromic repeats nonhomologous dna end joining operative surgical procedures hypertensive heart disease coronary heart disease small hairpin rna fetal growth retardation fetal growth dna cassette rna interferenceaffecting gene expression animal model placenta,gene expression model animal
107,527,205,preventive infection control in cardiac device implantation,001 system pacemaker diabetes cardiac cardiac ablation devices control implantation block including wearing skin ventricular implantationatrial ) mellitus disinfection fibrillation influenced infection implantable therapy year double removal infection electronic heart 010 gloves resynchronization also priorpreventive case device,neddylation and cardiac protein quality control,united states national institutes multicatalytic endopeptidase complex translational protein processing public health relevance mediated proteolysis pathway acute myocardial infarction ubiquitin like proteins protein degradation myocardial ischemia myocardial infarctioncardiac protein quality control neddylation,control
108,422,859,time to rethink: conscious sedation in an obese during pacemaker implantation,lung prolonged pacemaker must clock implantation apnea gene condition rare including mouse activity pacemaker certain sedation reconsider restrictive position rethink factors include although time cell expression sedation implantationpacemaker seems sleep disease risk deep required scn supine implantation performing one conscious associated rhythm obesecircadian consider inspiration associated,effects of exercise on neuronal activity in obese individuals,fatty acid glycerol esters functional magnetic resonance imaging united states national institutes hypertensive heart disease coronary heart disease research project grants weight gain prevention body weight decreased weight loss intervention weight maintenance regimenobese individuals neuronal activity exercise effects,disease activity
109,595,724,long-term mortality in patients with permanent pacemaker implantation,andf material remains cardiac aortic patients implantation observational low christian outcome dysrhythmias relatively rhythm methods two management collegepermanent pacemaker group procedure risk entire death rates period high college one prospective term conducted implantations year occurred complication safe year study medical tavr longvalve treat mortality device,impact of low flow nocturnal oxygen therapy on hospital admissions and mortality in patients with heart failure and central sleep apnea - dcc,united states national institutes electronic data capture system environmental air flow case report form sympathetic nervous system statistical data interpretation data coordinating center oxygen therapy care evidence based treatment central sleep apnealow flow nocturnal oxygen therapy central sleep apnea hospital admissions heart failure patients mortality impact dcc,patients mortality
110,917,497,management and outcome of patients with acute myocardial infarction presenting with pacemaker rhythm,presenting crude pacemaker cardiac doubled mortality ablation intrinsic patients managementatrial left block bundle amis either myocardial pci ventricular national pacemaker presentation swiss paced fibrillation branch undergoing acute data ventricular upon plus conduction year compared heart outcomes new using clinical infarction outcome infarction heart rhythm patients trials failure case registry registrationacute,development of the ptp1b inhibitor msi-1436 for therapeutic stimulation of heart regeneration following acute myocardial infarction,small business innovation research grant united states national institutes dependent diabetes mellitus world health organization health care costs chemical tissue distribution vascular blood supply protein tyrosine phosphatase cardiac function study coronary heart diseaseheart regeneration following acute myocardial infarction ptp1b inhibitor msi therapeutic stimulation development 1436,infarction cardiac myocardial heart national acute
111,723,389,leadless pacemaker implantation after transcatheter lead extraction in complex anatomy patient,leadless alternative subsequent active leads datum pm implantation strategy vasculartranscatheter traditional congenital two great method pacemaker contralateral therapy lead patientcardiac risk complex pm anatomy fixation importance high conclusion temporary transvenous crt step permanent year might including extraction valid device,cerebral anatomy hemodynamics and metabolism in single ventricles: relationship to neurodevelopment,superior vena cava structure united states national institutes diffusion magnetic resonance imaging magnetic resonance imaging pulmonary artery structure operative surgical procedures 9 year old venous pressure level public health relevance oxygen saturation measurementsingle ventricles cerebral anatomy relationship neurodevelopment metabolism hemodynamics,year anatomy
112,42,939,follow-up of patients with cardiac pacemakers,symptoms cardiac professionals play patients datum practitioners examinations followcardiac late method first therapy warrant risk pacemakers workup less high conclusion confronted crt urgent device flags year abstract general weeks pacemakers red includecardiac medical overtly associated,preclinical development of biological pacemakers,magnetic resonance imaging somatic gene therapy autonomic nervous system heart rate variability heart rate monitor left ventricular function heart rate heart function gene expression heart rhythmpreclinical development biological pacemakers,pacemakers therapy
113,910,529,tricuspid valve annuloplasty and mitral valve replacement are associated with bradyarrhythmia after mitral valve surgery,associatedcardiac datum 797 implantation explain factors anatomic mitral annuloplasty replacement %) method pacemaker therapy surgery risk relationships operative high conclusion bradyarrhythmia significant crt surgerytricuspid risk requiring year 2 requires help patients pacing valve device identified,novel therapeutic approaches to mitral valve repair in ischemic heart disease,randomized controlled trials operative surgical procedures magnetic resonance imaging novel therapeutic intervention cardiac surgery procedures mitral valve insufficiency mitral valve surgical sutures heart imaging valve replacementnovel therapeutic approaches mitral valve repair ischemic heart disease,mitral surgery operative valve
114,25,419,pacemaker treatment after fontan surgery-a swedish national study,defects inlet connection study pacemaker frequency cardiac respectively dysfunction ablation patients data left block right hypoplastic ). 44 fontan national pacemaker ventricular fibrillation likelyswedish %) outlet less node among 6 treatment univentricular % previous significantly sinus year double ventricle permanent surgeryatrial common implantation heart heart syndrome regarding cavopulmonary case total,national resource for translational and developmental proteomics,united states national institutes chronic lymphocytic leukemia acute myelocytic leukemia mass spectrum analysis general medical sciences public health relevance coronary heart disease national heart public health protein analysisnational resource developmental proteomics translational,national heart
115,125,720,ventricular tachycardia secondary to leadless pacemaker implantation in the setting of myocardial ischaemia,leadless alternative pacemaker cardiac practice ablation implantation block pacing implant tachycardia coronary myocardial ventricular artery pacemaker increasingly threatening presentventricular part fibrillation previously ventricular secondary cied disease year electrophysiology unrecognised developed infection arrythmias settingatrial heart life interesting pacemakers ischaemia case,phase iib - smart eyewear assistant for the support of seniors and their caregivers in the long-term care setting,85 +) improved handheld mobile device heart rate monitor patient home care mobile computing home environment wireless fidelity wearable computer text messaging term careterm care setting smart eyewear assistant phase iib support seniors long caregivers,heart
116,137,630,double twiddle trouble a new variant of twiddler syndrome,compromise aortic subsequent coiling results case implantation variantvalve outcome twiddler repositioningdouble pacemaker first group lead pocket risk treatment high malfunction ׳ level double reported twiddle year tavr new mortality trouble syndrome syndrome strategy dramatic,characterization of a lysosomal acid lipase variant associated with coronary disease,induced pluripotent stem cell genome wide association study public health relevance peptide signal sequences nonesterified fatty acids cell differentiation process coronary heart disease experimental study human disease coronary arteriosclerosislysosomal acid lipase variant associated coronary disease characterization,
117,258,378,complications and health care costs associated with transvenous cardiac pacemakers in a nationwide assessment,pacemaker claims cardiac patient cardiac ablation block medicare ventricular specialization nationwide retrospectively marketscan track supplementalhealth fibrillation health complicationsatrial varying transvenous characterize costs associated across scale year implanted care databases urban heart widely cohort associated u pacemakers assessment community case hospitals costs truven,regulation of cardiac development in health and disease,nucleic acid regulatory sequences induced pluripotent stem cell twin multiple birth single cell analysis next generation sequencing transcription regulatory protein public health relevance congenital heart disorder chromatin remodeling factor transcription factorcardiac development regulation health disease,health heart
118,371,209,the importance of selecting permanent pacemaker evaluating the heart and assessing quality of life in cardiac patient,pacemaker cardiac cardiac dysfunction ablation left block function right outflow causes qrs ventricular pacemaker additional paced ms contraction compares quality fibrillation function lead importance systolic ventricular pump subclinical ppm due patient information ventricle placement year tract duration evaluatingatrial 150 permanent study implantation avoid heart life gives also actsselecting assessing case impaired,utility of lung ultrasound in assessing pulmonary congestion in heart failure,oriented research career development award public health relevance extravascular lung water novel imaging technique clinical trials design career development public health program development research personnel research designassessing pulmonary congestion lung ultrasound heart failure utility,heart
119,331,476,an uncommon ecg manifestation of normal pacemaker function,physiological asymptomatic enhanced article aortic normal implantation systematic discusses outcome revealed pacemaker presumed group risk ecg manifestation causes electrocardiogram functionvalve high abnormal evaluation patient possible sensor features detection artifacts year similar tavr mortality machineuncommon,a critical period of sleep required for normal brain development,united states national institutes olfactory bulb glomeruli developmental delay disorders public health relevance olfactory receptor neurons national institute neurological disorders sleep disorders tyrosine 3 tenure tracknormal brain development sleep required critical period,
120,191,65,effects of permanent cardiac pacemaker implantation on vascular endothelial function blood coagulation and cardiac function in patients with bradycardia,pacemaker cardiac cardiac vascular ablation patients blood implantation left endothelial block tm function bradycardia ventricular activity pacemaker affects ) bradycardiaatrial c fibrillation coagulation indexespermanent function levels effects von end ejection ventricular year indexes vwf tissue factor heart tf antithrombin fraction willebr case,effects of maternal cortisol on perinatal cardiac metabolism and function,small molecule therapeutics citric acid cycle pyruvate dehydrogenase complex adrenal cortex hormones pyruvate dehydrogenase uterine contraction postnatal period pharmaceutical preparations pdh kinase pathway interactionsperinatal cardiac metabolism maternal cortisol function effects,cardiac function effects
121,389,396,investigating the manifestation of coronary artery disease and determining the role of effective factors in the need for pacemaker insertion in these patients,22 software aortic cardiac effective patients insertion implantation factors outcome obstructive mitral coronary artery pacemaker group risk manifestation performed factors investigating need high significant due spss disease stenosis determiningvalve permanent requiring year tavr severe using regurgitationcoronary insertion mortality patients role version affecting,determining the role of nucleoporins in ciliogenesis and heart development,nuclear pore complex proteins nuclear pore complex small hairpin rna operative surgical procedures candidate disease gene congenital heart disorder protein complex nuclear envelope functional disorder congenital abnormalityheart development role nucleoporins determining ciliogenesis,disease role
122,876,188,persistent atrial standstill following the cox-maze iii procedure: reversal with sustained atrial pacing,underwent maze pacemaker revisedpersistent became patient datum pericardial atrial following mitral replacement demand symptomatic valve standstill sustained method pacemaker therapy procedure sequential risk atrioventricular high conclusion ventricular crt dependent stenosis developed year tissue later coxcardiac iii reversal pacing standstill valve device,regulation and significance of sustained circadian oscillations,therapy design host microbiome gut microbiome gene structure gene expression circadian rhythms circadian pacemaker alpha rhythm biological models hormone metabolismsustained circadian oscillations significance regulation,pacemaker therapy
